{
  "engine": "fake",
  "speaker": "zh_male_m191_uranus_bigtts",
  "full_file": "full.mp3",
  "audio_seconds": 57.548,
  "lines": [
    {
      "id": "01",
      "section": "S01",
      "text": "你只要说出选题，剩下的工作全部交给它。",
      "context": [
        "用略带惊讶但克制的播报语气说"
      ],
      "silence_ms": 350,
      "speech_rate": 0,
      "start": 0.0,
      "end": 4.09,
      "duration_s": 4.09,
      "speech_end_s": 3.74,
      "file": "parts/01.wav",
      "logid": "fake-1",
      "error": null
    },
    {
      "id": "02",
      "section": "S01",
      "text": "从写稿到成片，中间不用你再动手。",
      "context": [
        "笃定"
      ],
      "silence_ms": 500,
      "speech_rate": 0,
      "start": 4.09,
      "end": 7.67,
      "duration_s": 3.58,
      "speech_end_s": 7.17,
      "file": "parts/02.wav",
      "logid": "fake-2",
      "error": null
    },
    {
      "id": "03",
      "section": "S02",
      "text": "整个流程是十个固定步骤，从环境检查开始。",
      "context": [
        "平稳清晰"
      ],
      "silence_ms": 300,
      "speech_rate": 0,
      "start": 7.67,
      "end": 11.93,
      "duration_s": 4.26,
      "speech_end_s": 11.63,
      "file": "parts/03.wav",
      "logid": "fake-3",
      "error": null
    },
    {
      "id": "04",
      "section": "S02",
      "text": "先写口播稿和数据来源，再用豆包配音，生成逐句时间轴。",
      "context": [],
      "silence_ms": 300,
      "speech_rate": 0,
      "start": 11.93,
      "end": 17.29,
      "duration_s": 5.36,
      "speech_end_s": 16.99,
      "file": "parts/04.wav",
      "logid": "fake-4",
      "error": null
    },
    {
      "id": "05",
      "section": "S02",
      "text": "接着按句分镜、找素材，搭好带三层结构的动画工程。",
      "context": [],
      "silence_ms": 300,
      "speech_rate": 0,
      "start": 17.29,
      "end": 22.21,
      "duration_s": 4.92,
      "speech_end_s": 21.91,
      "file": "parts/05.wav",
      "logid": "fake-5",
      "error": null
    },
    {
      "id": "06",
      "section": "S02",
      "text": "最后自检、渲染成片，再写好标题、简介和标签。",
      "context": [],
      "silence_ms": 450,
      "speech_rate": 0,
      "start": 22.21,
      "end": 26.62,
      "duration_s": 4.41,
      "speech_end_s": 26.17,
      "file": "parts/06.wav",
      "logid": "fake-6",
      "error": null
    },
    {
      "id": "07",
      "section": "S03",
      "text": "画面里的每个数字都要有出处，没有来源就不能上屏。",
      "context": [
        "强调规则"
      ],
      "silence_ms": 300,
      "speech_rate": 0,
      "start": 26.62,
      "end": 31.76,
      "duration_s": 5.14,
      "speech_end_s": 31.46,
      "file": "parts/07.wav",
      "logid": "fake-7",
      "error": null
    },
    {
      "id": "08",
      "section": "S03",
      "text": "段落之间有五种转场，镜头入场有三种。",
      "context": [],
      "silence_ms": 300,
      "speech_rate": 0,
      "start": 31.76,
      "end": 35.58,
      "duration_s": 3.82,
      "speech_end_s": 35.28,
      "file": "parts/08.wav",
      "logid": "fake-8",
      "error": null
    },
    {
      "id": "09",
      "section": "S03",
      "text": "自检不通过会自动修复，最多跑三轮，还不行就停下来报告。",
      "context": [],
      "silence_ms": 450,
      "speech_rate": 0,
      "start": 35.58,
      "end": 41.31,
      "duration_s": 5.73,
      "speech_end_s": 40.86,
      "file": "parts/09.wav",
      "logid": "fake-9",
      "error": null
    },
    {
      "id": "10",
      "section": "S04",
      "text": "默认做横屏，说一声竖屏，同一份数据直接切换画幅。",
      "context": [],
      "silence_ms": 300,
      "speech_rate": 0,
      "start": 41.31,
      "end": 46.23,
      "duration_s": 4.92,
      "speech_end_s": 45.93,
      "file": "parts/10.wav",
      "logid": "fake-10",
      "error": null
    },
    {
      "id": "11",
      "section": "S04",
      "text": "用到的第三方素材，作者和许可会自动写进简介。",
      "context": [],
      "silence_ms": 450,
      "speech_rate": 0,
      "start": 46.23,
      "end": 51.08,
      "duration_s": 4.85,
      "speech_end_s": 50.63,
      "file": "parts/11.wav",
      "logid": "fake-11",
      "error": null
    },
    {
      "id": "12",
      "section": "S05",
      "text": "想试试的话，复制文件夹，填好密钥，然后说开始制作。",
      "context": [
        "轻松收尾"
      ],
      "silence_ms": 300,
      "speech_rate": 0,
      "start": 51.08,
      "end": 56.0,
      "duration_s": 4.92,
      "speech_end_s": 55.7,
      "file": "parts/12.wav",
      "logid": "fake-12",
      "error": null
    },
    {
      "id": "13",
      "section": "S05",
      "text": "关注我，下期见。",
      "context": [],
      "silence_ms": 200,
      "speech_rate": 0,
      "start": 56.0,
      "end": 57.548,
      "duration_s": 1.548,
      "speech_end_s": 57.348,
      "file": "parts/13.wav",
      "logid": "fake-13",
      "error": null
    }
  ],
  "lufs": -16.2
}